url,title,content,content_length,code_block_count,headings_count,code_blocks,timestamp
https://pytorch.org/docs/stable/,PyTorch documentation — PyTorch 2.7 documentation,"PyTorch documentation ¶ PyTorch is an optimized tensor library for deep learning using GPUs and CPUs. Features described in this documentation are classified by release status: Stable: These features will be maintained long-term and there should generally
be no major performance limitations or gaps in documentation.
We also expect to maintain backwards compatibility (although
breaking changes can happen and notice will be given one release ahead
of time). Beta: These features are tagged as Beta because the API may change based on
user feedback, because the performance needs to improve, or because
coverage across operators is not yet complete. For Beta features, we are
committing to seeing the feature through to the Stable classification.
We are not, however, committing to backwards compatibility. Prototype: These features are typically not available as part of
binary distributions like PyPI or Conda, except sometimes behind run-time
flags, and are at an early stage for feedback and testing. Indices and tables ¶ Index Module Index",1045,0,5,,1752175598.5188153
https://pytorch.org/docs/stable/notes/randomness.html,Reproducibility — PyTorch 2.7 documentation,"Reproducibility ¶ Completely reproducible results are not guaranteed across PyTorch releases,
individual commits, or different platforms. Furthermore, results may not be
reproducible between CPU and GPU executions, even when using identical seeds. However, there are some steps you can take to limit the number of sources of
nondeterministic behavior for a specific platform, device, and PyTorch release.
First, you can control sources of randomness that can cause multiple executions
of your application to behave differently. Second, you can configure PyTorch
to avoid using nondeterministic algorithms for some operations, so that multiple
calls to those operations, given the same inputs, will produce the same result. Warning Deterministic operations are often slower than nondeterministic operations, so
single-run performance may decrease for your model. However, determinism may
save time in development by facilitating experimentation, debugging, and
regression testing. Controlling sources of randomness ¶ PyTorch random number generator ¶ You can use torch.manual_seed() to seed the RNG for all devices (both
CPU and CUDA): import torch torch . manual_seed ( 0 ) Some PyTorch operations may use random numbers internally. torch.svd_lowrank() does this, for instance. Consequently, calling it
multiple times back-to-back with the same input arguments may give different
results. However, as long as torch.manual_seed() is set to a constant
at the beginning of an application and all other sources of nondeterminism have
been eliminated, the same series of random numbers will be generated each time
the application is run in the same environment. It is also possible to obtain identical results from an operation that uses
random numbers by setting torch.manual_seed() to the same value between
subsequent calls. Python ¶ For custom operators, you might need to set python seed as well: import random random . seed ( 0 ) Random number generators in other libraries ¶ If you or any of the libraries you are using rely on NumPy, you can seed the global
NumPy RNG with: import numpy as np np . random . seed ( 0 ) However, some applications and libraries may use NumPy Random Generator objects,
not the global RNG
( https://numpy.org/doc/stable/reference/random/generator.html ), and those will
need to be seeded consistently as well. If you are using any other libraries that use random number generators, refer to
the documentation for those libraries to see how to set consistent seeds for them. CUDA convolution benchmarking ¶ The cuDNN library, used by CUDA convolution operations, can be a source of nondeterminism
across multiple executions of an application. When a cuDNN convolution is called with a
new set of size parameters, an optional feature can run multiple convolution algorithms,
benchmarking them to find the fastest one. Then, the fastest algorithm will be used
consistently during the rest of the process for the corresponding set of size parameters.
Due to benchmarking noise and different hardware, the benchmark may select different
algorithms on subsequent runs, even on the same machine. Disabling the benchmarking feature with torch.backends.cudnn.benchmark = False causes cuDNN to deterministically select an algorithm, possibly at the cost of reduced
performance. However, if you do not need reproducibility across multiple executions of your application,
then performance might improve if the benchmarking feature is enabled with torch.backends.cudnn.benchmark = True . Note that this setting is different from the torch.backends.cudnn.deterministic setting discussed below. Avoiding nondeterministic algorithms ¶ torch.use_deterministic_algorithms() lets you configure PyTorch to use
deterministic algorithms instead of nondeterministic ones where available, and
to throw an error if an operation is known to be nondeterministic (and without
a deterministic alternative). Please check the documentation for torch.use_deterministic_algorithms() for a full list of affected operations. If an operation does not act correctly
according to the documentation, or if you need a deterministic implementation
of an operation that does not have one, please submit an issue: https://github.com/pytorch/pytorch/issues?q=label:%22module:%20determinism%22 For example, running the nondeterministic CUDA implementation of torch.Tensor.index_add_() will throw an error: >>> import torch
>>> torch.use_deterministic_algorithms(True)
>>> torch.randn(2, 2).cuda().index_add_(0, torch.tensor([0, 1]), torch.randn(2, 2))
Traceback (most recent call last):
File ""<stdin>"", line 1, in <module>
RuntimeError: index_add_cuda_ does not have a deterministic implementation, but you set
'torch.use_deterministic_algorithms(True)'. ... When torch.bmm() is called with sparse-dense CUDA tensors it typically uses a
nondeterministic algorithm, but when the deterministic flag is turned on, its alternate
deterministic implementation will be used: >>> import torch >>> torch . use_deterministic_algorithms ( True ) >>> torch . bmm ( torch . randn ( 2 , 2 , 2 ) . to_sparse () . cuda (), torch . randn ( 2 , 2 , 2 ) . cuda ()) tensor([[[ 1.1900, -2.3409], [ 0.4796,  0.8003]], [[ 0.1509,  1.8027], [ 0.0333, -1.1444]]], device='cuda:0') Furthermore, if you are using CUDA tensors, and your CUDA version is 10.2 or greater, you
should set the environment variable CUBLAS_WORKSPACE_CONFIG according to CUDA documentation: https://docs.nvidia.com/cuda/cublas/index.html#results-reproducibility CUDA convolution determinism ¶ While disabling CUDA convolution benchmarking (discussed above) ensures that
CUDA selects the same algorithm each time an application is run, that algorithm
itself may be nondeterministic, unless either torch.use_deterministic_algorithms(True) or torch.backends.cudnn.deterministic = True is set. The latter setting
controls only this behavior, unlike torch.use_deterministic_algorithms() which will make other PyTorch operations behave deterministically, too. CUDA RNN and LSTM ¶ In some versions of CUDA, RNNs and LSTM networks may have non-deterministic behavior.
See torch.nn.RNN() and torch.nn.LSTM() for details and workarounds. Filling uninitialized memory ¶ Operations like torch.empty() and torch.Tensor.resize_() can return
tensors with uninitialized memory that contain undefined values. Using such a
tensor as an input to another operation is invalid if determinism is required,
because the output will be nondeterministic. But there is nothing to actually
prevent such invalid code from being run. So for safety, torch.utils.deterministic.fill_uninitialized_memory is set to True by default, which will fill the uninitialized memory with a known value if torch.use_deterministic_algorithms(True) is set. This will prevent the
possibility of this kind of nondeterministic behavior. However, filling uninitialized memory is detrimental to performance. So if your
program is valid and does not use uninitialized memory as the input to an
operation, then this setting can be turned off for better performance. DataLoader ¶ DataLoader will reseed workers following Randomness in multi-process data loading algorithm.
Use worker_init_fn() and generator to preserve reproducibility: def seed_worker ( worker_id ): worker_seed = torch . initial_seed () % 2 ** 32 numpy . random . seed ( worker_seed ) random . seed ( worker_seed ) g = torch . Generator () g . manual_seed ( 0 ) DataLoader ( train_dataset , batch_size = batch_size , num_workers = num_workers , worker_init_fn = seed_worker , generator = g , )",7542,6,14,"import torch
torch.manual_seed(0)
---
import random
random.seed(0)
---
import numpy as np
np.random.seed(0)
---
>>> import torch
>>> torch.use_deterministic_algorithms(True)
>>> torch.randn(2, 2).cuda().index_add_(0, torch.tensor([0, 1]), torch.randn(2, 2))
Traceback (most recent call last):
File ""<stdin>"", line 1, in <module>
RuntimeError: index_add_cuda_ does not have a deterministic implementation, but you set
'torch.use_deterministic_algorithms(True)'. ...
---
>>> import torch
>>> torch.use_deterministic_algorithms(True)
>>> torch.bmm(torch.randn(2, 2, 2).to_sparse().cuda(), torch.randn(2, 2, 2).cuda())
tensor([[[ 1.1900, -2.3409],
         [ 0.4796,  0.8003]],
        [[ 0.1509,  1.8027],
         [ 0.0333, -1.1444]]], device='cuda:0')
---
def seed_worker(worker_id):
    worker_seed = torch.initial_seed() % 2**32
    numpy.random.seed(worker_seed)
    random.seed(worker_seed)

g = torch.Generator()
g.manual_seed(0)

DataLoader(
    train_dataset,
    batch_size=batch_size,
    num_workers=num_workers,
    worker_init_fn=seed_worker,
    generator=g,
)",1752175599.566987
https://pytorch.org/docs/stable/notes/ddp.html,Distributed Data Parallel — PyTorch 2.7 documentation,"Distributed Data Parallel ¶ Warning The implementation of torch.nn.parallel.DistributedDataParallel evolves over time. This design note is written based on the state as of v1.4. torch.nn.parallel.DistributedDataParallel (DDP) transparently performs
distributed data parallel training. This page describes how it works and reveals
implementation details. Example ¶ Let us start with a simple torch.nn.parallel.DistributedDataParallel example. This example uses a torch.nn.Linear as the local model, wraps
it with DDP, and then runs one forward pass, one backward pass, and an optimizer
step on the DDP model. After that, parameters on the local model will be
updated, and all models on different processes should be exactly the same. import torch import torch.distributed as dist import torch.multiprocessing as mp import torch.nn as nn import torch.optim as optim import os from torch.nn.parallel import DistributedDataParallel as DDP def example ( rank , world_size ): # create default process group dist . init_process_group ( ""gloo"" , rank = rank , world_size = world_size ) # create local model model = nn . Linear ( 10 , 10 ) . to ( rank ) # construct DDP model ddp_model = DDP ( model , device_ids = [ rank ]) # define loss function and optimizer loss_fn = nn . MSELoss () optimizer = optim . SGD ( ddp_model . parameters (), lr = 0.001 ) # forward pass outputs = ddp_model ( torch . randn ( 20 , 10 ) . to ( rank )) labels = torch . randn ( 20 , 10 ) . to ( rank ) # backward pass loss_fn ( outputs , labels ) . backward () # update parameters optimizer . step () def main (): world_size = 2 mp . spawn ( example , args = ( world_size ,), nprocs = world_size , join = True ) if __name__ == ""__main__"" : # Environment variables which need to be # set when using c10d's default ""env"" # initialization mode. os . environ [ ""MASTER_ADDR"" ] = ""localhost"" os . environ [ ""MASTER_PORT"" ] = ""29500"" main () DDP works with TorchDynamo.  When used with TorchDynamo, apply the DDP model wrapper
before compiling the model, such that torchdynamo can apply DDPOptimizer (graph-break optimizations) based on DDP bucket sizes.  (See TorchDynamo DDPOptimizer for more information.) ddp_model = DDP ( model , device_ids = [ rank ]) ddp_model = torch . compile ( ddp_model ) Internal Design ¶ This section reveals how it works under the hood of torch.nn.parallel.DistributedDataParallel by diving into details of
every step in one iteration. Prerequisite : DDP relies on c10d ProcessGroup for communications.
Hence, applications must create ProcessGroup instances before constructing
DDP. Construction : The DDP constructor takes a reference to the local module,
and broadcasts state_dict() from the process with rank 0 to all other
processes in the group to make sure that all model replicas start from the
exact same state. Then, each DDP process creates a local Reducer , which
later will take care of the gradients synchronization during the backward
pass. To improve communication efficiency, the Reducer organizes parameter
gradients into buckets, and reduces one bucket at a time. Bucket size can be
configured by setting the bucket_cap_mb argument in DDP constructor. The
mapping from parameter gradients to buckets is determined at the construction
time, based on the bucket size limit and parameter sizes. Model parameters are
allocated into buckets in (roughly) the reverse order of Model.parameters() from the given model. The reason for using the reverse
order is because DDP expects gradients to become ready during the backward
pass in approximately that order. The figure below shows an example. Note
that, the grad0 and grad1 are in bucket1 , and the other two
gradients are in bucket0 . Of course, this assumption might not always
be true, and when that happens it could hurt DDP backward speed as the Reducer cannot kick off the communication at the earliest possible time.
Besides bucketing, the Reducer also registers autograd hooks during
construction, one hook per parameter. These hooks will be triggered during
the backward pass when the gradient becomes ready. Forward Pass : The DDP takes the input and passes it to the local model,
and then analyzes the output from the local model if find_unused_parameters is set to True . This mode allows running
backward on a subgraph of the model, and DDP finds out which parameters are
involved in the backward pass by traversing the autograd graph from the model
output and marking all unused parameters as ready for reduction. During the
backward pass, the Reducer would only wait for unready parameters, but it
would still reduce all buckets. Marking a parameter gradient as ready does not
help DDP skip buckets as for now, but it will prevent DDP from waiting for
absent gradients forever during the backward pass. Note that traversing the
autograd graph introduces extra overheads, so applications should only set find_unused_parameters to True when necessary. Backward Pass : The backward() function is directly invoked on the loss Tensor , which is out of DDP’s control, and DDP uses autograd hooks
registered at construction time to trigger gradients synchronizations. When
one gradient becomes ready, its corresponding DDP hook on that grad
accumulator will fire, and DDP will then mark that parameter gradient as
ready for reduction. When gradients in one bucket are all ready, the Reducer kicks off an asynchronous allreduce on that bucket to
calculate mean of gradients across all processes. When all buckets are ready,
the Reducer will block waiting for all allreduce operations to finish.
When this is done, averaged gradients are written to the param.grad field
of all parameters. So after the backward pass, the grad field on the same
corresponding parameter across different DDP processes should be the same. Optimizer Step : From the optimizer’s perspective, it is optimizing a local
model. Model replicas on all DDP processes can keep in sync because they all
start from the same state and they have the same averaged gradients in
every iteration. Note DDP requires Reducer instances on all processes to invoke allreduce in exactly the same order, which is done by always running allreduce in the bucket index order instead of actual bucket ready order. Mismatched allreduce order across processes can lead to wrong results or DDP backward
hang. Implementation ¶ Below are pointers to the DDP implementation components. The stacked graph shows
the structure of the code. ProcessGroup ¶ ProcessGroup.hpp :
contains the abstract API of all process group implementations. The c10d library provides 3 implementations out of the box, namely, ProcessGroupGloo , ProcessGroupNCCL , and ProcessGroupMPI . DistributedDataParallel uses ProcessGroup::broadcast() to send
model states from the process with rank 0 to others during initialization
and ProcessGroup::allreduce() to sum gradients. Store.hpp :
assists the rendezvous service for process group instances to find each other. DistributedDataParallel ¶ distributed.py :
is the Python entry point for DDP. It implements the initialization steps and
the forward function for the nn.parallel.DistributedDataParallel module which call into C++ libraries. Its _sync_param function performs
intra-process parameter synchronization when one DDP process works on multiple
devices, and it also broadcasts model buffers from the process with rank 0 to
all other processes. The inter-process parameter synchronization happens in Reducer.cpp . comm.h :
implements the coalesced broadcast helper function which is invoked to
broadcast model states during initialization and synchronize model buffers
before the forward pass. reducer.h :
provides the core implementation for gradient synchronization in the backward
pass. It has three entry point functions: Reducer : The constructor is called in distributed.py which registers Reducer::autograd_hook() to gradient accumulators. autograd_hook() function will be invoked by the autograd engine when
a gradient becomes ready. prepare_for_backward() is called at the end of DDP forward pass in distributed.py . It traverses the autograd graph to find unused
parameters when find_unused_parameters is set to True in DDP
constructor. TorchDynamo DDPOptimizer ¶ DDP’s performance advantage comes from overlapping allreduce collectives with computations during backwards.
AotAutograd prevents this overlap when used with TorchDynamo for compiling a whole forward and whole backward graph,
because allreduce ops are launched by autograd hooks _after_ the whole optimized backwards computation finishes. TorchDynamo’s DDPOptimizer helps by breaking the forward graph at the logical boundaries of DDP’s allreduce buckets
during backwards.  Note: the goal is to break the graph during backwards, and the simplest implementation is to
break the forward graphs and then call AotAutograd and compilation on each section.  This allows DDP’s allreduce hooks
to fire in-between sections of backwards, and schedule communications to overlap with compute. See this blog post for
a more in-depth explanation and experimental results, or read the docs and code at torch/_dynamo/optimizations/distributed.py To Debug DDPOptimizer, set TORCH_LOGS=’ddp_graphs’ for full graph dumps. For logs without graphs, add any of ‘dynamo’, ‘distributed’, or ‘dist_ddp’ to TORCH_LOGS (for basic info about bucket boundaries).  To disable DDPOptimizer, set torch._dynamo.config.optimize_ddp=False .
DDP and TorchDynamo should still work correctly without DDPOptimizer, but with performance degradation.",9523,2,10,"import torch
import torch.distributed as dist
import torch.multiprocessing as mp
import torch.nn as nn
import torch.optim as optim
import os
from torch.nn.parallel import DistributedDataParallel as DDP


def example(rank, world_size):
    # create default process group
    dist.init_process_group(""gloo"", rank=rank, world_size=world_size)
    # create local model
    model = nn.Linear(10, 10).to(rank)
    # construct DDP model
    ddp_model = DDP(model, device_ids=[rank])
    # define loss function and optimizer
    loss_fn = nn.MSELoss()
    optimizer = optim.SGD(ddp_model.parameters(), lr=0.001)

    # forward pass
    outputs = ddp_model(torch.randn(20, 10).to(rank))
    labels = torch.randn(20, 10).to(rank)
    # backward pass
    loss_fn(outputs, labels).backward()
    # update parameters
    optimizer.step()

def main():
    world_size = 2
    mp.spawn(example,
        args=(world_size,),
        nprocs=world_size,
        join=True)

if __name__==""__main__"":
    # Environment variables which need to be
    # set when using c10d's default ""env""
    # initialization mode.
    os.environ[""MASTER_ADDR""] = ""localhost""
    os.environ[""MASTER_PORT""] = ""29500""
    main()
---
ddp_model = DDP(model, device_ids=[rank])
ddp_model = torch.compile(ddp_model)",1752175600.6315124
